https://www.reed.co.uk/jobs/head-office-role/40400004?source=searchResults#/jobs/travel-agency-managers-jobs,"<span itemprop=""description""> <p><strong>Are you looking for that next move? Achieve together is looking for </strong> </p> <p><strong>Regional Recruitment Manager - London -Surrey</strong></p> <p>To identify an effective recruitment strategy for a defined region to attract and retain key talent and ensure consistency in staffing within services.</p> <p>In depth understanding of best practice recruitment processes</p> <p>To work with Regional Recruitment Managers to ensure that there is a consistent approach to recruitment across the organisation</p> <p>Motivate and lead a recruitment team within a fast paced recruitment envirourment</p> <p>Experience of identifying and running reports on key recruitment metrics Analytical - Commercial</p> <p>Willing to travel within the defined region</p> <p>Moving from Agency or RPO to Internal RRM</p> <p>Achieve together is a care provider a sense of empathy is needed along side the above  </p> About The Company <p>We are a leading provider of care and support to adults with learning disabilities and associated health needs, including autistic spectrum conditions, mental health needs, challenging behaviour, profound and multiple learning disabilities and epilepsy.</p> <p>The people we support live in homely, family-like residences, and are encouraged to participate fully in their local community.</p> <p>We are committed to safeguarding and promoting the welfare of all the people we support, adults and children, and expect all staff to share this commitment.</p> <p><strong>Why work for Achieve together</strong></p> <p>In addition to your salary, our benefits package includes:</p> <ul> <li>a pension scheme</li><li>paid annual leave</li><li>reward/recognition schemes</li><li>a generous staff discount and benefits scheme</li><li>excellent opportunities for career progression</li></ul> </span>"
https://www.reed.co.uk/jobs/operations-manager---social-care/40428634?source=searchResults#/jobs/travel-agency-managers-jobs,"<span itemprop=""description"">Are you looking for a rewarding job where you go home knowing that you have made a real impact on people’s lives? <p>Sense is looking for a dynamic and solution focused Operations Manager to lead a diverse range of services which provide person-centred support to people who have complex support needs, including people with sensory impairments, autism and learning disabilities.</p> <p>This role is to cover London and the Home Counties, occasionally supporting across all of our South Region services where necessary.  You will contribute to the growth of  Sense's Operational Service across the South working as part of an exceptional team. </p> About the role <p>• This role will cover Supported Living, Residential, and Day and Community Support<br/>• The services in are diverse and cover a wide geographic area. The successful applicant will be flexible, able to travel, a good role model, have good leadership qualities and able to listen to the people we support - we work in a co-production model and so  the views of families and significant others are important to us. <br/>• This role will challenge, excite and never be dull with all complexities of working for a vibrant values based organisation, but it will be truly rewarding for the right person.</p> In return we will offer you <p>• Bespoke, rewarding career pathways<br/>• The opportunity to work in a large, diverse and successful charity where people can develop their skills, knowledge and careers in a supportive and flexible environment.<br/>• Group Personal Pension scheme<br/>• Generous annual leave entitlement</p> About you <p>You could be an experienced social care manager or from a different sector with transferable skills; a social worker, nurse or allied health professional looking for a change of direction and ready for a fresh challenge in a people-centred organisation.  </p> <strong>Essential:</strong> <p>• Passionate about delivering high-quality, person-centred services <br/>• Sound knowledge of person centred planning, rota planning, staff management/development and budget management.<br/>• Relish the opportunity to lead a team of service managers who work hard to ensure that the people we support are enabled to live the lives they want.<br/>• A full UK driving licence and use of your own vehicle</p> <strong>Desirable:</strong> <p>• Understanding of a large charitable organisation <br/>• Experience of leading and managing strategic and operational change<br/>• Experience in contributing to writing successful grant proposals and bids<br/>• Demonstrable experience of effective business planning and delivery of services</p> About Sense… <p><br/>Sense has a proven record of offering high quality, pioneering services. For everyone living with complex disabilities. For everyone who is deafblind. Sense is here to help people communicate and experience the world.<br/>We believe that no one, no matter how complex their disabilities, should be isolated, left out, or unable to fulfil their potential.<br/></p> To apply… <p>Please use the link below to complete your application. </p> <p>Managers will use your application to shortlist candidates in relation to the Personal Specification; therefore it is very important that you complete this section thoroughly.  We would recommend that you read the candidate guidelines and job description  (found at the base of this advert) before applying.</p> <p><strong>The interview will be panel based and we will ask you questions based around your previous experience and the role you have applied for. We will be holding interviews as suitable applications are received, so the role may close before the advertised  date</strong>.</p> <p>If you are a disabled candidate and require a hard copy pack or a different format please contact the recruitment team on or textphone .</p> <p>Sense is committed to safeguarding and promoting the welfare of vulnerable children and adults and expects all employees to share this commitment. Therefore all offers of employment, where appropriate, are subject to an enhanced DBS check.<br/>Sense is an Equal Opportunities Employer and is committed to ensuring that all staff are motivated, skilled and rewarded by their work.</p> <p>No agency submissions without prior authorisation from Sense, any applications submitted will be treated as our own, as such no fee will be payable. If you have applied for this position in the last three months your application will not be considered.</p> </span>"
https://www.reed.co.uk/jobs/finance-manager/40438002?source=searchResults#/jobs/travel-agency-managers-jobs,"<span itemprop=""description""> <p><strong>Finance manager</strong> - Required to work for this lovely niche tour operator based close to Haywards Heath. They are looking for an experienced accounts person who must have a travel industry background. They will pay up to £30,000 plus benefits  with an immediate start. <br/><br/><strong>Accounts/Finance managers duties</strong><br/>-Manage payment schedules to supplier and bank reconciliations<br/>-Take client payments and allocate transactions<br/>-Manage 5 current accounts and 4 credit card accounts<br/>-Be responsible for payroll and VAT reporting<br/>-Run pre-payments and accrual costs reports<br/>-Help prepare monthly and annual accounts<br/>-Assist with sales analysis to determine the performance of the sales team<br/>-Undertake general office duties<br/><br/><strong>Accounts/Finance managers skills required</strong><br/>-Accounts experience in travel is essential, please dont apply if you dont have travel industry experience<br/>-Have extensive Quickbooks experience<br/>-Be self motivated, accurate, organised, a team player and an effective communicator<br/>-Have an understanding of all accounts duties<br/>-Be familiar with currency transactions<br/><br/>If you are interested in the above role and have previous travel industry accounts experience please send me your cv to </p> <p><strong>Don't keep a good thing to yourself</strong><br/>We grow our business through referrals, so please don't keep us to yourself. If you think we're doing a good job and know of someone who would benefit from our services, please pass on their name and number to me and I promise we will follow it up. Many thanks. <br/><br/>C&amp;M Travel Recruitment is acting as an Employment Agency in relation to this vacancy. We are committed to equality of opportunity for all candidates. For more opportunities, please visit www.candm.co.uk</p> </span>"
https://www.reed.co.uk/jobs/business-travel-sales-manager/40449070?source=searchResults#/jobs/travel-agency-managers-jobs,"<span itemprop=""description""> <p><br/><strong>Business travel Sales manager </strong>-Required for this ambitious TMC, they are looking for a experienced Business development/Sales manager from another TMC who can be based anywhere in the UK, with a proven track record of winning business over  a number of years. They will pay a basic salary off between 40/48k with uncapped commission, first year earnings around 64k plus benefits.<br/><br/><strong>Business travel sales managers duties<br/>-</strong>Working remotely with a mix off home based and on the road<strong>,</strong> you will be responsible for identifying, targeting and converting new prospective business into trading accounts.<br/>-Achieving set sales targets and generating sales leads.<br/>-Close liaison with the marketing manager for marketing and advertising activities<br/>-Coordinate the implementation of new business with the implementation manager<br/>-Responsible for sourcing and compiling tenders<br/><br/><strong>Business travel sales managers skills required</strong><br/>-Strong proven sales background working for another TMC for a number of years in business development/sales<br/>-Ideally experience in targeting both corporate and marine business, but this is not essential<br/>-Good presentation skills are essential<br/>-A proven track record of building relationships in a corporate environment</p> <p><br/>If you are interested in the above role please call Duncan on quoting DT55074 or send your cv to <br/><br/>-<br/><br/></p> <p><strong>Don't keep a good thing to yourself</strong><br/>We grow our business through referrals, so please don't keep us to yourself. If you think we're doing a good job and know of someone who would benefit from our services, please pass on their name and number to me and I promise we will follow it up. Many thanks. <br/><br/>C&amp;M Travel Recruitment is acting as an Employment Agency in relation to this vacancy. We are committed to equality of opportunity for all candidates. For more opportunities, please visit www.candm.co.uk</p> </span>"
https://www.reed.co.uk/jobs/business-development-manager/40391799?source=searchResults#/jobs/travel-agency-managers-jobs,"<span itemprop=""description""> <p><br/><strong>Business development manager</strong> - Required for this independent TMC based in Manchester or Glasgow. They are looking for an experienced business development manager with previous TMC experience and a proven background in bringing in new business.  They will pay a basic of 25/30k + fantastic comm and benefits.<br/><br/><strong>Business development managers duties</strong><br/>-Based either in Manchester or Glasgow your role will to develop new business for this expanding business travel company from cold calling, attending meetings, writing tenders, giving presentations, closing the sale as well as help with the implementation.<br/>- They generally look for new business ranging from the 100k to 800k level, so experience winning this level of business would be beneficial<br/><br/><strong>Business development managers skills required</strong><br/>-Business development management experience for a TMC is a must<br/>-Proven background in winning new accounts and figures to back this up<br/>-Experience in the full process of winning new business, including cold calling for leads, presenting and closing business<br/><br/><strong>Additional information<br/>-</strong>Very good commission will be paid on business won<br/>-Mileage and expenses will be paid<br/>-Office based apart from when you are out and about visiting clients<br/><br/>If you are interested in the above role please email your cv to quoting DT55077<br/><br/></p> <p><strong>Don't keep a good thing to yourself</strong><br/>We grow our business through referrals, so please don't keep us to yourself. If you think we're doing a good job and know of someone who would benefit from our services, please pass on their name and number to me and I promise we will follow it up. Many thanks. <br/><br/>C&amp;M Travel Recruitment is acting as an Employment Agency in relation to this vacancy. We are committed to equality of opportunity for all candidates. For more opportunities, please visit www.candm.co.uk</p> </span>"
https://www.reed.co.uk/jobs/hv-electrical-project-manager/40306312?source=searchResults#/jobs/travel-agency-managers-jobs,"<span itemprop=""description""> <p>HV Electrical Project Manager, </p> <p>£50k-£60k +Travel</p> <p>London / Essex / Nationwide travel <br/><br/>I am currently looking for an experienced HV Electrical Project Manager to join a market leading Electrical company based in Essex.<br/><br/>You will be responsible for:-</p> <ul> <li>The delivery of complex, high voltage cabling installation projects</li><li>Capable in supporting the technical and operational requirements of high value tenders</li><li>Commercial, programme and planning of projects</li><li>Working collaboratively with the Contract Managers and Support Functions to deliver your projects</li><li>Stakeholder engagement and management</li></ul> <p><br/>You will have -</p> <ul> <li>EHV, HV or LV cabling experience (National Grid voltages are an advantage)</li><li>Familiarity with HV asset owner Competency / SAP processes a distinct advantage</li><li>Demonstrable commercial project management experience at £10 million + as a budget holder</li><li>Checkable work history and testimonials</li></ul> <p>Randstad CPE values diversity and promotes equality. No terminology in this advert is intended to discriminate against any of the protected characteristics that fall under the Equality Act 2010. We encourage and welcome applications from all sections of  society and are more than happy to discuss reasonable adjustments and/or additional arrangements as required to support your application.</p> <p>Candidates must be eligible to live and work in the UK.</p> <p>For the purposes of the Conduct Regulations 2003, when advertising permanent vacancies we are acting as an Employment Agency, and when advertising temporary/contract vacancies we are acting as an Employment Business.</p> </span>"
https://www.reed.co.uk/jobs/data-room-coordinator-admin/40482378?source=searchResults#/jobs/travel-agency-managers-jobs,"<span itemprop=""description""> <p><strong>Transport Control Room Coordinator</strong></p> <p><strong>Based in Hinckley</strong></p> <p><strong>Various fixed shifts available</strong></p> <p><strong>Morning Shift 05:30-13:30 £10.00 per hour</strong></p> <p><strong>Afternoon Shift 1300-2130 £10.50 per hour</strong></p> <p><strong>Night Shift 2100-0530 £10.77 per hour </strong></p> <p><strong>Days of work : Monday-Friday</strong></p> <p><strong>Job outline</strong></p> <p>To analyse real-time data produced by Microlise and react according. Produce hourly updates and reports to senior linehaul managers. Contact drivers directly by phone to gain information or solve problems. Training provided.</p> <p><strong>To apply for this role you will be able to demonstrate:-</strong></p> <p>Computer knowledge and skills</p> <p>A clear telephone manner</p> <p>Be numerate and literate</p> <p>Show some knowledge of microlise or similar telematic packages (preferred)</p> <p>Knowledge or experience of the transport industry (preferred)</p> <p>Be able to travel to work independantly (as start times can sometimes change)</p> <p>Must have a fully checkable work history</p> <p>To apply please submit your C.V. to this vacancy</p> <p><em>Extra Personnel Limited acts as an employment agency for permanent recruitment and employment business for the supply of temporary workers.</em></p> </span>"
https://www.reed.co.uk/jobs/human-resources-manager/40351301?source=searchResults#/jobs/travel-agency-managers-jobs,"<span itemprop=""description""> <p>We have an excellent opportunity for a fully qualified and experienced HR Manager to join a well established company in the Newhaven area.</p> <p>This is a HR Manager position with full responsibility for Human Resources across all departments and multiple sites in the Sussex area.</p> <p>The Human Resources Manager will be based full time in Newhaven with occasional travel required and duties will include:</p> <ul> <li>Being responsible for all HR functions for the group</li><li>Produce and implement the HR strategy and practices, developing and promoting a culture in line with company goals</li><li>Provide direction and leadership to the HR and Payroll functions</li><li>Manage all resourcing, recruitment and talent acquisition, working with Line Managers to successfully interview and recruit new team members</li></ul> <p>You’ll need to be a qualified Senior HR Generalist, ideally with CIPD Level 7 or equivalent and strong experience as a Human Resources Generalist. Experience in manufacturing or similar sectors is essential.</p> <p>The salary is up to £50k, possibly a little more for the right candidate, dependent on experience plus company benefits.</p> <p>First Recruitment Services ltd is acting as an employment agency.</p> </span>"
https://www.reed.co.uk/jobs/administrator/40450543?source=searchResults#/jobs/travel-agency-managers-jobs,"<span itemprop=""description""> <p>My client is looking for a Administrator to join their team ASAP. They are a family run business who has grown year on year and they want someone to join them who is not afraid to jump in at the deep end. Duties will include: </p> <ul> <li>Book meetings and installations</li><li>Taking inbound and outbound calls </li><li>Maintain internal databases</li><li>Organising the installation diary</li><li>Maintain a filing system for data on customers and external partners</li><li>Distribute incoming and outgoing mail</li><li>Working on the CRM system and Microsoft packages</li><li>Organise, store and print company documents as needed</li><li>Answer and redirect phone calls</li><li>Make travel arrangements</li><li>Handle queries from managers and employees</li></ul> <p>This is an exciting permanent opportunity, interviews will be held virtually with the owner of the business. </p> <p>Adecco acts as an employment agency for permanent recruitment and an employment business for the supply of temporary workers. The Adecco Group UK &amp; Ireland is an Equal Opportunities Employer.</p> <p>By applying for this role your details will be submitted to Adecco. Our Candidate Privacy Information Statement explains how we will use your information - please copy and paste the following link in to your browser https://candidate-privacy </p> </span>"
https://www.reed.co.uk/jobs/operations-director---healthcare-recruitment-agency/40464491?source=searchResults#/jobs/travel-agency-managers-jobs,"<span itemprop=""description"">Operations Director - Healthcare Recruitment Agency<br/>£65,000 - £75,000 (DOE) + bonus + benefits<br/>Leeds<br/><br/>Talent Lift are recruiting on behalf of a well-funded, successful recruitment agency, who are seeking to add to their senior leadership team. For this high profile role, it is essential that you have extensive experience within healthcare recruitment.<br/><br/>In this leadership position, you'll have significant day to day responsibility. Driving performance and results across significant numbers of consultants. You will be a proven leader of people, as well as being highly sales driven. This is a true lead-from-the-front  role. (Significant UK travel may be required from time to time).<br/><br/>Please note that this role is within a recruitment agency: You must have significant experience of healthcare recruitment - within a recruitment agency environment. Unfortunately we will not be able to shortlist you without this prior experience.<br/><br/>We're looking for an accomplished, senior healthcare recruitment professional - who is still a hands-on recruiter at heart! This a rare opportunity to join a superb recruitment business, in a key role. Talk to us today for more details.<br/><br/>Please note that recruitment agency experience is essential for this position. Please only apply for this position if you have recruitment agency experience.<br/><br/>About Talent Lift:<br/><br/>We partner with brilliant recruitment businesses to find them brilliant people. Working exclusively with innovative and fast growth firms within the recruitment sector; recruiting exceptional people into genuinely career-changing opportunities. Talent Lift  specialise in senior appointments, including managers, directors, board level positions and key support roles. We're proud to work with some of the UK's most exciting recruitment companies.<br/><br/>Like the businesses that we recruit for, we're dynamic, proactive and fresh-thinking. Working discreetly, with precision and complete integrity at all times. If you're ready to lift your career to the next level then let's talk. (Complete confidentiality assured).</span>"
https://www.reed.co.uk/jobs/senior-commercial-resolution-manager/40435574?source=searchResults#/jobs/travel-agency-managers-jobs,"<span itemprop=""description""> <p>New opportunity within a large public sector organisation for an experienced Commercial Resolutions Manager <br/><br/><strong>Your new company</strong><br/>You will be working for a large public sector organisation based in Birmingham with travel across the UK. <br/><br/><strong>Your new role</strong><br/>This role is key to the successful operation of the Commercial and Procurement Directorate of this large public sector organisation. Working within the Commercial Resolution Team, which is part of the Commercial Services Division, to manage Commercial Resolution  Managers and lead on negotiations. Manage the monitoring and management of contractual issues and disputes, provide support and expert advice to senior managers, project delivery teams and contribute to reports to senior managers. The main purpose of the role  is to support the development and implementation of improvements to the commercial governance of schemes through increased commercial awareness and understanding; and to collaborate with commercial colleagues to assist the development of commercial capability  within the Directorate.<br/><br/><strong>What you'll need to succeed</strong><br/>You will hold a professional qualification such as CIPS, RICS, IACCM or similar and have current experience in a Commercial Resolution role, sector is not particularly imperative in this instance as long as you have sound understanding and experience of legal  escalation processes, dispute resolution and dispute avoidance. <br/><br/><strong>What you'll get in return</strong><br/>You will be paid up to £68,000 depending on experience and suitability alongside a generous public sector benefits package. Flexible working options are available.<br/><br/><strong>What you need to do now</strong><br/>If you're interested in this role, click 'apply now' to forward an up-to-date copy of your CV, or call us now.<br/>If this job isn't quite right for you but you are looking for a new position, please contact us for a confidential discussion on your career.</p> <p>Hays Specialist Recruitment Limited acts as an employment agency for permanent recruitment and employment business for the supply of temporary workers. By applying for this job you accept the T&amp;C's, Privacy Policy and Disclaimers which can be found at hays.co.uk</p> </span>"
